{
  "id": "returning-big-pity-7.0",
  "version": "7.0",
  "audience": "returning",
  "goalTier": "big-pity",
  "bannerPhase": 1,
  "targetPrimogems": 28800,
  "goal": {
    "mode": "fixed-wishes",
    "banner": "limited-character",
    "defaultRequiredWishes": 180,
    "note": "默认按角色池最坏情况计算；用户补充垫数和大保底状态后可缩小目标。"
  },
  "rankingStrategy": {
    "sortOrder": [
      "availability",
      "confidence",
      "deadline",
      "reward-per-minute",
      "priority",
      "exploration"
    ],
    "priorityWeights": {
      "must-do": 340,
      "recommended": 140,
      "optional": 20
    },
    "defaultDailyMinutes": 60,
    "maxRecommendations": 5,
    "note": "优先安排回坑后可立即领取、限时和低前置内容，压低长线全探索权重。"
  },
  "title": "回坑玩家 · 大保底收手攻略",
  "summary": "适合退坑一段时间后回坑的玩家，目标是在上半卡池结束前攒够大保底（180抽/28800原石）。优先做性价比高的任务，砍掉耗时过长的全探索。同步开始养角色材料，抽到后直接突破。",
  "estimatedTotalHours": 25,
  "planWindow": {
    "calculatedAt": "2026-08-17",
    "bannerEndsAt": "2026-09-01T17:59:00+08:00",
    "remainingDays": 15,
    "note": "原25小时计划需平均每天约1.7小时。仅将已确认且仍可领取的项目作为保证资源；预估、条件性和待确认项目单独展示。"
  },
  "resourcePool": [
    {
      "sourceId": "maintenance-compensation",
      "priority": "must-do",
      "status": "pending"
    },
    {
      "sourceId": "preview-livestream-codes",
      "priority": "optional",
      "status": "pending",
      "availabilityStatus": "expired",
      "note": "前瞻兑换码已过有效期，不计入 8 月 17 日起的计划。"
    },
    {
      "sourceId": "daily-commission-phase1",
      "priority": "must-do",
      "status": "pending"
    },
    {
      "sourceId": "stardust-exchange",
      "priority": "recommended",
      "status": "pending",
      "availabilityStatus": "conditional",
      "note": "需要已有星尘，不作为无条件可得原石。"
    },
    {
      "sourceId": "starglitter-exchange",
      "priority": "optional",
      "status": "pending",
      "availabilityStatus": "conditional",
      "note": "需要已有星辉；按 5 星辉兑换 1 纠缠之缘，无兑换上限，不计入固定收益。"
    },
    {
      "sourceId": "battle-pass-free",
      "priority": "optional",
      "status": "pending",
      "availabilityStatus": "conditional",
      "note": "相遇之缘不能用于限定角色池。"
    },
    {
      "sourceId": "archon-quest-7.0",
      "priority": "must-do",
      "status": "pending"
    },
    {
      "sourceId": "new-bud-support-first-snowfield",
      "priority": "must-do",
      "status": "pending",
      "availabilityStatus": "expired",
      "note": "已于 8 月 24 日截止，保留作归档。"
    },
    {
      "sourceId": "snezhnaya-travel-handbook",
      "priority": "must-do",
      "status": "pending",
      "availabilityStatus": "expired",
      "note": "已于 8 月 25 日截止，保留作归档。"
    },
    {
      "sourceId": "qiyu-treasure",
      "priority": "recommended",
      "status": "pending"
    },
    {
      "sourceId": "stygian-onslaught-7-0",
      "priority": "optional",
      "status": "pending",
      "note": "高难挑战，不计入攒石目标。"
    },
    {
      "sourceId": "heated-battle-mode-7-0",
      "priority": "optional",
      "status": "pending",
      "note": "无原石奖励，按兴趣完成。"
    },
    {
      "sourceId": "teapot-exchange",
      "priority": "optional",
      "status": "pending",
      "availabilityStatus": "available",
      "note": "仅提供养成资源，不计入抽卡资源。"
    },
    {
      "sourceId": "exploration-snezhnaya-chests",
      "priority": "recommended",
      "status": "pending",
      "note": "跟影月月的一条龙视频跑，选择性开箱"
    },
    {
      "sourceId": "exploration-cryo-oculi",
      "priority": "recommended",
      "status": "pending"
    },
    {
      "sourceId": "world-quest-snezhnaya",
      "priority": "recommended",
      "status": "pending"
    },
    {
      "sourceId": "domain-first-clears-snezhnaya",
      "priority": "recommended",
      "status": "pending",
      "note": "和材料本安排在一起"
    },
    {
      "sourceId": "offerings-snezhnaya",
      "priority": "optional",
      "status": "pending"
    },
    {
      "sourceId": "spiral-abyss-first-clear",
      "priority": "recommended",
      "status": "pending",
      "note": "视练度决定，能打多少打多少"
    },
    {
      "sourceId": "spiral-abyss-reset",
      "priority": "recommended",
      "status": "pending"
    },
    {
      "sourceId": "imaginary-theater-first-performance",
      "priority": "recommended",
      "status": "pending",
      "note": "一次性初演馈赠。"
    },
    {
      "sourceId": "imaginary-theater-seasonal-tour",
      "priority": "recommended",
      "status": "pending",
      "note": "轮换巡演奖励。"
    },
    {
      "sourceId": "achievements-7.0",
      "priority": "optional",
      "status": "pending",
      "note": "顺手做，不必刻意刷"
    }
  ],
  "materialPlan": {
    "characterIds": [
      "aodata",
      "arlechino"
    ],
    "weeklySchedule": [
      {
        "day": "mon",
        "activities": [
          {
            "type": "talent-domain",
            "target": "慈爱系列",
            "resin": 20,
            "note": "奥黛塔"
          },
          {
            "type": "weapon-domain",
            "target": "无垢系列",
            "resin": 20,
            "note": "阿蕾奇诺"
          },
          {
            "type": "weapon-domain",
            "target": "荒野树妖系列",
            "resin": 20,
            "note": "奥黛塔"
          }
        ]
      },
      {
        "day": "tue",
        "activities": [
          {
            "type": "talent-domain",
            "target": "秩序系列",
            "resin": 20,
            "note": "阿蕾奇诺"
          },
          {
            "type": "normal-boss",
            "target": "铁甲熔炉",
            "resin": 40,
            "note": "阿蕾奇诺"
          },
          {
            "type": "exploration",
            "target": "虹彩蔷薇采集",
            "resin": 0,
            "note": "阿蕾奇诺"
          }
        ]
      },
      {
        "day": "wed",
        "activities": [
          {
            "type": "normal-boss",
            "target": "不灭衍生造物",
            "resin": 40,
            "note": "奥黛塔"
          },
          {
            "type": "exploration",
            "target": "霜仙花采集",
            "resin": 0,
            "note": "奥黛塔"
          },
          {
            "type": "exploration",
            "target": "敌人掉落",
            "resin": 0,
            "note": "奥黛塔 / 阿蕾奇诺"
          }
        ]
      },
      {
        "day": "thu",
        "activities": [
          {
            "type": "talent-domain",
            "target": "慈爱系列",
            "resin": 20,
            "note": "奥黛塔"
          },
          {
            "type": "weapon-domain",
            "target": "无垢系列",
            "resin": 20,
            "note": "阿蕾奇诺"
          },
          {
            "type": "weapon-domain",
            "target": "荒野树妖系列",
            "resin": 20,
            "note": "奥黛塔"
          }
        ]
      },
      {
        "day": "fri",
        "activities": [
          {
            "type": "talent-domain",
            "target": "秩序系列",
            "resin": 20,
            "note": "阿蕾奇诺"
          },
          {
            "type": "normal-boss",
            "target": "铁甲熔炉",
            "resin": 40,
            "note": "阿蕾奇诺"
          },
          {
            "type": "exploration",
            "target": "虹彩蔷薇采集",
            "resin": 0,
            "note": "阿蕾奇诺"
          }
        ]
      },
      {
        "day": "sat",
        "activities": [
          {
            "type": "weekly-boss",
            "target": "多托雷 / 仆人周本",
            "resin": 60,
            "note": "奥黛塔 / 阿蕾奇诺"
          },
          {
            "type": "exploration",
            "target": "霜仙花采集",
            "resin": 0,
            "note": "奥黛塔"
          },
          {
            "type": "exploration",
            "target": "敌人掉落",
            "resin": 0,
            "note": "奥黛塔 / 阿蕾奇诺"
          }
        ]
      },
      {
        "day": "sun",
        "activities": [
          {
            "type": "talent-domain",
            "target": "慈爱系列 / 秩序系列",
            "resin": 20,
            "note": "奥黛塔 / 阿蕾奇诺"
          },
          {
            "type": "weapon-domain",
            "target": "荒野树妖系列 / 无垢系列",
            "resin": 20,
            "note": "奥黛塔 / 阿蕾奇诺"
          },
          {
            "type": "exploration",
            "target": "敌人掉落",
            "resin": 0,
            "note": "奥黛塔 / 阿蕾奇诺"
          }
        ]
      }
    ]
  },
  "timeline": [
    {
      "dayRange": "第1-3天",
      "focus": "版本更新福利 + 主线开荒",
      "taskIds": [
        "maintenance-compensation",
        "archon-quest-7.0"
      ],
      "notes": "优先领完所有兑换码和福利，然后开始推主线。同步采集霜仙花和虹彩蔷薇"
    },
    {
      "dayRange": "第4-9天",
      "focus": "活动 + 探索",
      "taskIds": [
        "daily-commission-phase1",
        "exploration-snezhnaya-chests"
      ],
      "notes": "跟影月月一条龙视频探索，每天做委托+活动。天赋本/武器本按日轮换刷"
    },
    {
      "dayRange": "第10-13天",
      "focus": "深渊 + 世界任务 + 查漏补缺",
      "taskIds": [
        "spiral-abyss-first-clear",
        "spiral-abyss-reset",
        "imaginary-theater-first-performance",
        "imaginary-theater-seasonal-tour",
        "world-quest-snezhnaya",
        "achievements-7.0"
      ],
      "notes": "尝试深渊和剧诗，做剩余世界任务。检查原石是否达标"
    },
    {
      "dayRange": "第14-15天",
      "focus": "最后冲刺 + 兑换",
      "taskIds": [
        "qiyu-treasure",
        "stardust-exchange",
        "starglitter-exchange",
        "battle-pass-free",
        "teapot-exchange"
      ],
      "notes": "最后确认所有兑换都领取，查漏补缺。确保抽卡资源到位"
    }
  ]
}
