{
  "id": "new-player-big-pity-7.0",
  "version": "7.0",
  "audience": "new",
  "goalTier": "big-pity",
  "bannerPhase": 1,
  "targetPrimogems": 28800,
  "goal": {
    "mode": "fixed-wishes",
    "banner": "limited-character",
    "defaultRequiredWishes": 180,
    "note": "默认按角色池最坏情况计算；用户补充垫数和大保底状态后可缩小目标。"
  },
  "rankingStrategy": {
    "sortOrder": [
      "availability",
      "confidence",
      "deadline",
      "reward-per-minute",
      "priority",
      "exploration"
    ],
    "priorityWeights": {
      "must-do": 320,
      "recommended": 150,
      "optional": 30
    },
    "defaultDailyMinutes": 60,
    "maxRecommendations": 5,
    "note": "优先保证短期可完成、前置较少的任务；探索批次在主线开放后上升。"
  },
  "title": "新玩家 · 大保底收手攻略",
  "summary": "适合刚入坑的新玩家。新玩家有大量一次性原石来源（旧版本探索/任务/成就），加上7.0新内容，攒够大保底相对容易。但需要注意时间分配，优先做高性价比任务。本套餐也适合时间有限的上班族/学生。",
  "estimatedTotalHours": 40,
  "planWindow": {
    "calculatedAt": "2026-08-17",
    "bannerEndsAt": "2026-09-01T17:59:00+08:00",
    "remainingDays": 15,
    "note": "原40小时计划需平均每天约2.7小时。新玩家尚未录入的旧版本一次性资源不计入本套餐的保证资源。"
  },
  "resourcePool": [
    {
      "sourceId": "maintenance-compensation",
      "priority": "must-do",
      "status": "pending"
    },
    {
      "sourceId": "preview-livestream-codes",
      "priority": "optional",
      "status": "pending",
      "availabilityStatus": "expired",
      "note": "前瞻兑换码已过有效期，不计入 8 月 17 日起的计划。"
    },
    {
      "sourceId": "daily-commission-phase1",
      "priority": "must-do",
      "status": "pending"
    },
    {
      "sourceId": "stardust-exchange",
      "priority": "recommended",
      "status": "pending",
      "availabilityStatus": "conditional",
      "note": "需要已有星尘，不作为无条件可得原石。"
    },
    {
      "sourceId": "starglitter-exchange",
      "priority": "optional",
      "status": "pending",
      "availabilityStatus": "conditional",
      "note": "需要已有星辉；按 5 星辉兑换 1 纠缠之缘，无兑换上限，不计入固定收益。"
    },
    {
      "sourceId": "battle-pass-free",
      "priority": "optional",
      "status": "pending",
      "availabilityStatus": "conditional",
      "note": "相遇之缘不能用于限定角色池。"
    },
    {
      "sourceId": "archon-quest-7.0",
      "priority": "must-do",
      "status": "pending",
      "note": "新玩家需先完成前置章节"
    },
    {
      "sourceId": "new-bud-support-first-snowfield",
      "priority": "must-do",
      "status": "pending",
      "availabilityStatus": "expired",
      "note": "已于 8 月 24 日截止，保留作归档。"
    },
    {
      "sourceId": "snezhnaya-travel-handbook",
      "priority": "must-do",
      "status": "pending",
      "availabilityStatus": "expired",
      "note": "已于 8 月 25 日截止，保留作归档。"
    },
    {
      "sourceId": "qiyu-treasure",
      "priority": "recommended",
      "status": "pending"
    },
    {
      "sourceId": "stygian-onslaught-7-0",
      "priority": "optional",
      "status": "pending",
      "note": "高难挑战，不计入攒石目标。"
    },
    {
      "sourceId": "heated-battle-mode-7-0",
      "priority": "optional",
      "status": "pending",
      "note": "无原石奖励，按兴趣完成。"
    },
    {
      "sourceId": "teapot-exchange",
      "priority": "optional",
      "status": "pending",
      "availabilityStatus": "available",
      "note": "仅提供养成资源，不计入抽卡资源。"
    },
    {
      "sourceId": "exploration-snezhnaya-chests",
      "priority": "must-do",
      "status": "pending",
      "note": "新玩家探索收益极高"
    },
    {
      "sourceId": "exploration-cryo-oculi",
      "priority": "must-do",
      "status": "pending"
    },
    {
      "sourceId": "world-quest-snezhnaya",
      "priority": "recommended",
      "status": "pending"
    },
    {
      "sourceId": "domain-first-clears-snezhnaya",
      "priority": "recommended",
      "status": "pending",
      "note": "和每日材料本顺路完成"
    },
    {
      "sourceId": "offerings-snezhnaya",
      "priority": "recommended",
      "status": "pending"
    },
    {
      "sourceId": "spiral-abyss-first-clear",
      "priority": "recommended",
      "status": "pending",
      "note": "新玩家可能练度不足，尽力而为"
    },
    {
      "sourceId": "spiral-abyss-reset",
      "priority": "optional",
      "status": "pending",
      "note": "练度不足可跳过"
    },
    {
      "sourceId": "imaginary-theater-first-performance",
      "priority": "optional",
      "status": "pending",
      "note": "一次性初演馈赠，需要大量角色。"
    },
    {
      "sourceId": "imaginary-theater-seasonal-tour",
      "priority": "optional",
      "status": "pending",
      "note": "轮换巡演奖励，需要大量角色。"
    },
    {
      "sourceId": "achievements-7.0",
      "priority": "recommended",
      "status": "pending"
    }
  ],
  "materialPlan": {
    "characterIds": [
      "aodata",
      "arlechino"
    ],
    "weeklySchedule": [
      {
        "day": "mon",
        "activities": [
          {
            "type": "talent-domain",
            "target": "慈爱系列",
            "resin": 20,
            "note": "奥黛塔"
          },
          {
            "type": "weapon-domain",
            "target": "无垢系列",
            "resin": 20,
            "note": "阿蕾奇诺"
          },
          {
            "type": "weapon-domain",
            "target": "荒野树妖系列",
            "resin": 20,
            "note": "奥黛塔"
          }
        ]
      },
      {
        "day": "tue",
        "activities": [
          {
            "type": "talent-domain",
            "target": "秩序系列",
            "resin": 20,
            "note": "阿蕾奇诺"
          },
          {
            "type": "normal-boss",
            "target": "铁甲熔炉",
            "resin": 40,
            "note": "阿蕾奇诺"
          },
          {
            "type": "exploration",
            "target": "虹彩蔷薇采集",
            "resin": 0,
            "note": "阿蕾奇诺"
          }
        ]
      },
      {
        "day": "wed",
        "activities": [
          {
            "type": "normal-boss",
            "target": "不灭衍生造物",
            "resin": 40,
            "note": "奥黛塔"
          },
          {
            "type": "exploration",
            "target": "霜仙花采集",
            "resin": 0,
            "note": "奥黛塔"
          },
          {
            "type": "exploration",
            "target": "敌人掉落",
            "resin": 0,
            "note": "奥黛塔 / 阿蕾奇诺"
          }
        ]
      },
      {
        "day": "thu",
        "activities": [
          {
            "type": "talent-domain",
            "target": "慈爱系列",
            "resin": 20,
            "note": "奥黛塔"
          },
          {
            "type": "weapon-domain",
            "target": "无垢系列",
            "resin": 20,
            "note": "阿蕾奇诺"
          },
          {
            "type": "weapon-domain",
            "target": "荒野树妖系列",
            "resin": 20,
            "note": "奥黛塔"
          }
        ]
      },
      {
        "day": "fri",
        "activities": [
          {
            "type": "talent-domain",
            "target": "秩序系列",
            "resin": 20,
            "note": "阿蕾奇诺"
          },
          {
            "type": "normal-boss",
            "target": "铁甲熔炉",
            "resin": 40,
            "note": "阿蕾奇诺"
          },
          {
            "type": "exploration",
            "target": "虹彩蔷薇采集",
            "resin": 0,
            "note": "阿蕾奇诺"
          }
        ]
      },
      {
        "day": "sat",
        "activities": [
          {
            "type": "weekly-boss",
            "target": "多托雷 / 仆人周本",
            "resin": 60,
            "note": "奥黛塔 / 阿蕾奇诺"
          },
          {
            "type": "exploration",
            "target": "霜仙花采集",
            "resin": 0,
            "note": "奥黛塔"
          },
          {
            "type": "exploration",
            "target": "敌人掉落",
            "resin": 0,
            "note": "奥黛塔 / 阿蕾奇诺"
          }
        ]
      },
      {
        "day": "sun",
        "activities": [
          {
            "type": "talent-domain",
            "target": "慈爱系列 / 秩序系列",
            "resin": 20,
            "note": "奥黛塔 / 阿蕾奇诺"
          },
          {
            "type": "weapon-domain",
            "target": "荒野树妖系列 / 无垢系列",
            "resin": 20,
            "note": "奥黛塔 / 阿蕾奇诺"
          },
          {
            "type": "exploration",
            "target": "敌人掉落",
            "resin": 0,
            "note": "奥黛塔 / 阿蕾奇诺"
          }
        ]
      }
    ]
  },
  "timeline": [
    {
      "dayRange": "第1-3天",
      "focus": "福利全领 + 主线推进 + 前置任务",
      "taskIds": [
        "maintenance-compensation",
        "archon-quest-7.0"
      ],
      "notes": "新玩家可能需要先完成前置魔神任务章节。优先领福利，然后推主线"
    },
    {
      "dayRange": "第4-8天",
      "focus": "7.0新区域探索 + 活动",
      "taskIds": [
        "exploration-snezhnaya-chests",
        "daily-commission-phase1"
      ],
      "notes": "新玩家探索收益极高，跟影月月一条龙跑。同步刷材料"
    },
    {
      "dayRange": "第9-12天",
      "focus": "世界任务 + 成就 + 深渊尝试",
      "taskIds": [
        "world-quest-snezhnaya",
        "achievements-7.0",
        "qiyu-treasure",
        "spiral-abyss-first-clear"
      ],
      "notes": "做世界任务和成就，尝试深渊首通"
    },
    {
      "dayRange": "第13-15天",
      "focus": "兑换 + 查漏补缺",
      "taskIds": [
        "qiyu-treasure",
        "stardust-exchange",
        "starglitter-exchange",
        "battle-pass-free",
        "teapot-exchange"
      ],
      "notes": "确认所有兑换领取，原石是否达标"
    }
  ]
}
