{
  "id": "returning-max-7.0",
  "version": "7.0",
  "audience": "returning",
  "goalTier": "max",
  "bannerPhase": 1,
  "targetPrimogems": 50000,
  "goal": {
    "mode": "maximize",
    "banner": "limited-character",
    "defaultRequiredWishes": 0,
    "note": "没有固定抽数上限；持续推荐未完成且高性价比的永久和限时资源。"
  },
  "rankingStrategy": {
    "sortOrder": [
      "availability",
      "deadline",
      "confidence",
      "reward-per-minute",
      "exploration",
      "priority"
    ],
    "priorityWeights": {
      "must-do": 290,
      "recommended": 210,
      "optional": 110
    },
    "defaultDailyMinutes": 90,
    "maxRecommendations": 7,
    "note": "在不漏掉限时内容的前提下，逐步展开探索、任务和成就。"
  },
  "title": "回坑玩家 · 尽量多拿攻略",
  "summary": "适合有一定空闲时间的回坑玩家，目标是在上半卡池期间尽可能多地获取原石，冲刺命座或专武。穷举所有来源，按优先级排布，确保高价值项优先完成。适合想抽命座或同时抽两个限定角色的玩家。",
  "estimatedTotalHours": 50,
  "planWindow": {
    "calculatedAt": "2026-08-17",
    "bannerEndsAt": "2026-09-01T17:59:00+08:00",
    "remainingDays": 15,
    "note": "原50小时计划需平均每天约3.3小时。仅将已确认且仍可领取的项目作为保证资源；预估、条件性和待确认项目单独展示。"
  },
  "resourcePool": [
    {
      "sourceId": "maintenance-compensation",
      "priority": "must-do",
      "status": "pending"
    },
    {
      "sourceId": "preview-livestream-codes",
      "priority": "optional",
      "status": "pending",
      "availabilityStatus": "expired",
      "note": "前瞻兑换码已过有效期，不计入 8 月 17 日起的计划。"
    },
    {
      "sourceId": "daily-commission-phase1",
      "priority": "must-do",
      "status": "pending"
    },
    {
      "sourceId": "stardust-exchange",
      "priority": "recommended",
      "status": "pending",
      "availabilityStatus": "conditional",
      "note": "需要已有星尘，不作为无条件可得原石。"
    },
    {
      "sourceId": "starglitter-exchange",
      "priority": "optional",
      "status": "pending",
      "availabilityStatus": "conditional",
      "note": "需要已有星辉；按 5 星辉兑换 1 纠缠之缘，无兑换上限，不计入固定收益。"
    },
    {
      "sourceId": "battle-pass-free",
      "priority": "optional",
      "status": "pending",
      "availabilityStatus": "conditional",
      "note": "相遇之缘不能用于限定角色池。"
    },
    {
      "sourceId": "archon-quest-7.0",
      "priority": "must-do",
      "status": "pending"
    },
    {
      "sourceId": "new-bud-support-first-snowfield",
      "priority": "must-do",
      "status": "pending",
      "availabilityStatus": "expired",
      "note": "已于 8 月 24 日截止，保留作归档。"
    },
    {
      "sourceId": "snezhnaya-travel-handbook",
      "priority": "must-do",
      "status": "pending",
      "availabilityStatus": "expired",
      "note": "已于 8 月 25 日截止，保留作归档。"
    },
    {
      "sourceId": "qiyu-treasure",
      "priority": "recommended",
      "status": "pending"
    },
    {
      "sourceId": "stygian-onslaught-7-0",
      "priority": "optional",
      "status": "pending",
      "note": "高难挑战，不计入攒石目标。"
    },
    {
      "sourceId": "heated-battle-mode-7-0",
      "priority": "optional",
      "status": "pending",
      "note": "无原石奖励，按兴趣完成。"
    },
    {
      "sourceId": "teapot-exchange",
      "priority": "optional",
      "status": "pending",
      "availabilityStatus": "available",
      "note": "仅提供养成资源，不计入抽卡资源。"
    },
    {
      "sourceId": "exploration-snezhnaya-chests",
      "priority": "must-do",
      "status": "pending",
      "note": "全宝箱跟跑影月月一条龙"
    },
    {
      "sourceId": "exploration-cryo-oculi",
      "priority": "must-do",
      "status": "pending"
    },
    {
      "sourceId": "world-quest-snezhnaya",
      "priority": "must-do",
      "status": "pending",
      "note": "全做"
    },
    {
      "sourceId": "domain-first-clears-snezhnaya",
      "priority": "must-do",
      "status": "pending"
    },
    {
      "sourceId": "offerings-snezhnaya",
      "priority": "must-do",
      "status": "pending"
    },
    {
      "sourceId": "achievements-7.0",
      "priority": "must-do",
      "status": "pending",
      "note": "全成就，含隐藏成就"
    },
    {
      "sourceId": "spiral-abyss-first-clear",
      "priority": "must-do",
      "status": "pending"
    },
    {
      "sourceId": "spiral-abyss-reset",
      "priority": "must-do",
      "status": "pending"
    },
    {
      "sourceId": "imaginary-theater-first-performance",
      "priority": "must-do",
      "status": "pending",
      "note": "一次性初演馈赠。"
    },
    {
      "sourceId": "imaginary-theater-seasonal-tour",
      "priority": "must-do",
      "status": "pending",
      "note": "轮换巡演奖励。"
    }
  ],
  "materialPlan": {
    "characterIds": [
      "aodata",
      "arlechino"
    ],
    "weeklySchedule": [
      {
        "day": "mon",
        "activities": [
          {
            "type": "talent-domain",
            "target": "慈爱系列",
            "resin": 20,
            "note": "奥黛塔"
          },
          {
            "type": "weapon-domain",
            "target": "无垢系列",
            "resin": 20,
            "note": "阿蕾奇诺"
          },
          {
            "type": "weapon-domain",
            "target": "荒野树妖系列",
            "resin": 20,
            "note": "奥黛塔"
          }
        ]
      },
      {
        "day": "tue",
        "activities": [
          {
            "type": "talent-domain",
            "target": "秩序系列",
            "resin": 20,
            "note": "阿蕾奇诺"
          },
          {
            "type": "normal-boss",
            "target": "铁甲熔炉",
            "resin": 40,
            "note": "阿蕾奇诺"
          },
          {
            "type": "exploration",
            "target": "虹彩蔷薇采集",
            "resin": 0,
            "note": "阿蕾奇诺"
          }
        ]
      },
      {
        "day": "wed",
        "activities": [
          {
            "type": "normal-boss",
            "target": "不灭衍生造物",
            "resin": 40,
            "note": "奥黛塔"
          },
          {
            "type": "artifact-domain",
            "target": "炉火融炼之心 / 谐律异想断套",
            "resin": 40,
            "note": "奥黛塔 / 阿蕾奇诺"
          },
          {
            "type": "exploration",
            "target": "霜仙花采集",
            "resin": 0,
            "note": "奥黛塔"
          },
          {
            "type": "exploration",
            "target": "敌人掉落",
            "resin": 0,
            "note": "奥黛塔 / 阿蕾奇诺"
          }
        ]
      },
      {
        "day": "thu",
        "activities": [
          {
            "type": "talent-domain",
            "target": "慈爱系列",
            "resin": 20,
            "note": "奥黛塔"
          },
          {
            "type": "weapon-domain",
            "target": "无垢系列",
            "resin": 20,
            "note": "阿蕾奇诺"
          },
          {
            "type": "weapon-domain",
            "target": "荒野树妖系列",
            "resin": 20,
            "note": "奥黛塔"
          }
        ]
      },
      {
        "day": "fri",
        "activities": [
          {
            "type": "talent-domain",
            "target": "秩序系列",
            "resin": 20,
            "note": "阿蕾奇诺"
          },
          {
            "type": "normal-boss",
            "target": "铁甲熔炉",
            "resin": 40,
            "note": "阿蕾奇诺"
          },
          {
            "type": "artifact-domain",
            "target": "炉火融炼之心 / 谐律异想断套",
            "resin": 40,
            "note": "奥黛塔 / 阿蕾奇诺"
          },
          {
            "type": "exploration",
            "target": "虹彩蔷薇采集",
            "resin": 0,
            "note": "阿蕾奇诺"
          }
        ]
      },
      {
        "day": "sat",
        "activities": [
          {
            "type": "weekly-boss",
            "target": "多托雷 / 仆人周本",
            "resin": 60,
            "note": "奥黛塔 / 阿蕾奇诺"
          },
          {
            "type": "normal-boss",
            "target": "不灭衍生造物",
            "resin": 40,
            "note": "奥黛塔"
          },
          {
            "type": "exploration",
            "target": "霜仙花采集",
            "resin": 0,
            "note": "奥黛塔"
          },
          {
            "type": "exploration",
            "target": "敌人掉落",
            "resin": 0,
            "note": "奥黛塔 / 阿蕾奇诺"
          }
        ]
      },
      {
        "day": "sun",
        "activities": [
          {
            "type": "talent-domain",
            "target": "慈爱系列 / 秩序系列",
            "resin": 20,
            "note": "奥黛塔 / 阿蕾奇诺"
          },
          {
            "type": "weapon-domain",
            "target": "荒野树妖系列 / 无垢系列",
            "resin": 20,
            "note": "奥黛塔 / 阿蕾奇诺"
          },
          {
            "type": "artifact-domain",
            "target": "炉火融炼之心 / 谐律异想断套",
            "resin": 40,
            "note": "奥黛塔 / 阿蕾奇诺"
          },
          {
            "type": "exploration",
            "target": "敌人掉落",
            "resin": 0,
            "note": "奥黛塔 / 阿蕾奇诺"
          }
        ]
      }
    ]
  },
  "timeline": [
    {
      "dayRange": "第1-3天",
      "focus": "福利全领 + 主线全通",
      "taskIds": [
        "maintenance-compensation",
        "archon-quest-7.0"
      ],
      "notes": "第一天就把所有兑换码、福利领完，然后全力推主线"
    },
    {
      "dayRange": "第4-6天",
      "focus": "全探索跟跑",
      "taskIds": [
        "exploration-snezhnaya-chests",
        "exploration-cryo-oculi",
        "daily-commission-phase1"
      ],
      "notes": "跟影月月一条龙视频全探索，每天2-3小时。同步采集特产和刷材料"
    },
    {
      "dayRange": "第7-11天",
      "focus": "活动 + 世界任务 + 成就",
      "taskIds": [
        "qiyu-treasure",
        "stygian-onslaught-7-0",
        "heated-battle-mode-7-0",
        "world-quest-snezhnaya",
        "achievements-7.0"
      ],
      "notes": "完成所有活动和世界任务，查攻略做隐藏成就"
    },
    {
      "dayRange": "第12-15天",
      "focus": "深渊 + 查漏补缺 + 兑换",
      "taskIds": [
        "spiral-abyss-first-clear",
        "spiral-abyss-reset",
        "imaginary-theater-first-performance",
        "imaginary-theater-seasonal-tour",
        "stardust-exchange",
        "starglitter-exchange",
        "battle-pass-free",
        "teapot-exchange"
      ],
      "notes": "打深渊和剧诗，确认所有来源都已领取"
    }
  ]
}
